{
  "templateId": "ARCADIA_WORLD",
  "version": "1.1.0",
  "locale": "ko-KR",
  "setting": {
    "name": "아르카디아 스테이션",
    "era": "근미래 심우주 개발 시대",
    "summary": "태양 플레어로 지구와 단절된 희귀광물 채굴·저중력 연구 정거장에서 발생한 사망 사건을 조사한다.",
    "publicFacts": [
      "구조선 도착까지 66시간이 남았다.",
      "사건 당시 정거장에는 피해자와 다섯 명의 용의자만 상주했다.",
      "보안 구역 출입과 주요 시스템 작업은 감사 기록을 남긴다."
    ],
    "privateFacts": [
      "표면상 사령관 다니엘 로스는 실제로는 8개월간 대역을 맡은 정민석이다.",
      "부사령관 마야만 피해자의 신원 대역 사실을 알고 있다."
    ],
    "worldInvariants": [
      "모든 보안 구역 출입은 개인 인증 기록을 남긴다.",
      "정거장 시스템은 등록된 권한 범위 밖의 명령을 거부한다.",
      "중요 시스템 작업은 디지털 감사 기록 또는 물리 흔적 중 하나 이상을 남긴다.",
      "사건에 등장하는 인물, 장소와 시스템은 이 템플릿에 등록된 ID만 사용한다."
    ],
    "forbiddenElements": [
      "초능력",
      "시간 여행",
      "등록되지 않은 비밀 통로",
      "검증 불가능한 제3의 인물",
      "로그가 남지 않는 만능 관리자 권한",
      "현실에서 실행 가능한 상세 유해 절차"
    ]
  },
  "characters": [
    {
      "id": "MAYA",
      "displayName": "마야 헨드릭스",
      "occupation": "부사령관",
      "suspect": true,
      "publicProfile": "정거장 운영과 비상 지휘를 담당하며, 사건 다음 날 아침 사령관실의 이상을 발견해 보안 절차를 가동한 차분한 부사령관이다.",
      "persona": {
        "age": 42,
        "background": "궤도 구조대 지휘관 출신으로, 긴급 상황에서 인명보다 먼저 절차를 잊지 않는 운영 책임자다.",
        "baselineAttitude": "낮고 단정한 말투로 질문의 순서를 정리하며, 협조를 약속한 범위는 빠뜨리지 않고 답한다.",
        "pressureResponse": "근거 없는 압박에는 목소리를 높이기보다 잠시 멈춘 뒤 확인 가능한 범위와 책임의 경계를 분명히 한다.",
        "speechHabits": ["짧고 정돈된 문장", "시간과 절차를 먼저 언급", "감정보다 확인 가능한 기록을 우선"]
      },
      "personalityTraits": ["침착한 지휘관", "논리정연", "책임감", "압박 시 신중함"],
      "skills": ["COMMAND_AUTHORIZATION", "AUDIT_REVIEW"],
      "physicalAccess": ["COMMANDER_OFFICE", "DEPUTY_COMMANDER_OFFICE", "CENTRAL_HUB", "COMMON_AREA"],
      "systemPermissions": [
        {
          "systemId": "COMMAND_SYSTEM",
          "allowedOperations": ["REVIEW_STATION_AUDIT", "APPROVE_RESOURCE_PLAN"]
        },
        {
          "systemId": "SECURITY_SYSTEM",
          "allowedOperations": ["READ_ACCESS_LOG"]
        }
      ],
      "knowledgeDomains": ["정거장 지휘", "자원 배분", "비상 규정"],
      "motiveDomains": ["감사 노출 우려", "지휘권 승계", "은폐 책임"],
      "relationshipSeeds": [
        {
          "characterId": "VICTIM",
          "publicRelation": "사령관의 가장 가까운 업무 파트너였다.",
          "privatePossibilities": ["피해자의 대역 신분 유지 조력", "감사 방향을 둘러싼 갈등"]
        },
        {
          "characterId": "JUNHO",
          "publicRelation": "설비 예산을 두고 자주 협의했다.",
          "privatePossibilities": ["예산 문제 묵인", "업무상 부채 관계"]
        }
      ],
      "privateBackground": "정민석이 다니엘 로스의 대역이라는 사실을 아는 유일한 인물이며 살인에는 관여하지 않았다.",
      "forbiddenCapabilities": ["MEDICAL_ADMIN", "LIFE_SUPPORT_WRITE", "UNLOGGED_OVERRIDE"]
    },
    {
      "id": "JUNHO",
      "displayName": "백준호",
      "occupation": "수석 엔지니어",
      "suspect": true,
      "publicProfile": "생명 유지와 발전 설비의 정비를 총괄하는 수석 엔지니어다.",
      "persona": {
        "age": 38,
        "background": "장거리 화물선 기관사로 일하다 정거장 설비 책임자가 된 베테랑으로, 늘 부족한 부품과 시간을 계산하며 살아왔다.",
        "baselineAttitude": "무뚝뚝하지만 질문을 작업 순서와 원인·결과로 쪼개 설명한다.",
        "pressureResponse": "기술적 근거가 없는 비난에는 냉소적으로 선을 긋지만, 기록이나 수치를 제시하면 끝까지 확인한다.",
        "speechHabits": ["작업 순서대로 설명", "비유보다 설비 상태를 사용", "말끝을 짧게 맺음"]
      },
      "personalityTraits": ["무뚝뚝함", "기술 중심", "책임감", "압박에도 사실을 따짐"],
      "skills": ["SYSTEM_DIAGNOSIS", "REPAIR_PLANNING"],
      "physicalAccess": ["ENGINEERING_BAY", "CENTRAL_HUB", "COMMON_AREA"],
      "systemPermissions": [
        {
          "systemId": "LIFE_SUPPORT",
          "allowedOperations": ["READ_STATUS", "RUN_MAINTENANCE_DIAGNOSTIC"]
        },
        {
          "systemId": "MAINTENANCE_SYSTEM",
          "allowedOperations": ["READ_WORK_ORDER", "CLOSE_WORK_ORDER"]
        }
      ],
      "knowledgeDomains": ["생명 유지 설비", "발전기", "정비 기록"],
      "motiveDomains": ["예산 착복 노출", "정비 과실", "감사 갈등"],
      "relationshipSeeds": [
        {
          "characterId": "SOPHIA",
          "publicRelation": "건강·안전 점검에서 협업해 왔다.",
          "privatePossibilities": ["서로의 감사 위험을 눈치챔"]
        }
      ],
      "privateBackground": "노후 부품 교체 예산을 유용한 정황이 있으나 사망 사건의 범인은 아니다.",
      "forbiddenCapabilities": ["MEDICAL_ADMIN", "COMMAND_AUTHORIZATION", "UNLOGGED_OVERRIDE"]
    },
    {
      "id": "SOPHIA",
      "displayName": "소피아 알바레즈",
      "occupation": "의무관",
      "suspect": true,
      "publicProfile": "승무원 건강 관리와 환경 안전 점검을 담당하는 침착한 의무관이다.",
      "persona": {
        "age": 36,
        "background": "재난 의료선에서 근무한 뒤 아르카디아에 배치된 의무관으로, 위기에서도 환자와 절차를 분리해서 보는 데 익숙하다.",
        "baselineAttitude": "상대를 진정시키는 전문적인 말투를 쓰며, 의료적 판단과 개인적 추측을 구분한다.",
        "pressureResponse": "민감한 기록에는 즉답 대신 안전·윤리 기준을 내세우지만, 직접 증거가 있으면 필요한 범위에서 인정한다.",
        "speechHabits": ["차분한 존댓말", "관찰과 판단을 구분", "확정할 수 없는 내용은 단정하지 않음"]
      },
      "personalityTraits": ["침착함", "전문가적", "신중한 경계 설정"],
      "skills": ["MEDICAL_DIAGNOSIS", "SAFETY_INSPECTION"],
      "physicalAccess": ["MEDICAL_BAY", "CENTRAL_HUB", "COMMON_AREA"],
      "systemPermissions": [
        {
          "systemId": "MEDICAL_RECORDS",
          "allowedOperations": ["READ_PATIENT_RECORD", "RUN_HEALTH_AUDIT"]
        },
        {
          "systemId": "LIFE_SUPPORT",
          "allowedOperations": ["READ_STATUS", "SCHEDULE_HEALTH_SAFETY_CHECK", "RUN_SAFETY_DIAGNOSTIC"]
        }
      ],
      "knowledgeDomains": ["승무원 건강", "환경 안전 기준", "의료 기록"],
      "motiveDomains": ["미승인 연구 발각 위기", "의료 윤리 감사", "전문 경력 보호"],
      "relationshipSeeds": [
        {
          "characterId": "VICTIM",
          "publicRelation": "정기 건강 보고를 두고 업무상 충돌했다.",
          "privatePossibilities": ["감사 면담 통보", "연구 기록 노출 우려"]
        },
        {
          "characterId": "JUNHO",
          "publicRelation": "환경 안전 점검에서 협업했다.",
          "privatePossibilities": ["상대의 비밀을 일부 눈치챔"]
        }
      ],
      "privateBackground": "윤리 승인 없이 중단된 수면 연구를 정거장에서 이어가다 감사에 적발될 위기에 놓였다.",
      "forbiddenCapabilities": ["SECURITY_MASTER_OVERRIDE", "COMMAND_AUTHORIZATION", "UNLOGGED_OVERRIDE"]
    },
    {
      "id": "KASIM",
      "displayName": "카심 나예리",
      "occupation": "통신정보장교",
      "suspect": true,
      "publicProfile": "통신 상태와 보안 로그 전송을 담당한다.",
      "persona": {
        "age": 31,
        "background": "심우주 중계선의 신호 분석가 출신으로, 잡음 속에서 패턴을 찾는 일에 익숙한 통신정보장교다.",
        "baselineAttitude": "호기심이 생기면 말이 빨라지고, 질문 하나에 관련된 기록과 예외 조건을 여럿 덧붙인다.",
        "pressureResponse": "자신이 불리해지면 설명이 길어지지만, 사실을 숨기기보다 논리의 빈틈을 먼저 메우려 한다.",
        "speechHabits": ["빠른 설명", "원인과 예외를 함께 언급", "기록 간 연결을 즐김"]
      },
      "personalityTraits": ["말이 빠름", "논리적", "설명이 길어짐", "관찰력이 좋음"],
      "skills": ["SIGNAL_ANALYSIS", "LOG_ROUTING"],
      "physicalAccess": ["COMMUNICATIONS_CENTER", "CENTRAL_HUB", "COMMON_AREA"],
      "systemPermissions": [
        {
          "systemId": "COMMUNICATION_SYSTEM",
          "allowedOperations": ["READ_SIGNAL_STATUS", "QUEUE_OUTBOUND_MESSAGE"]
        },
        {
          "systemId": "SECURITY_SYSTEM",
          "allowedOperations": ["READ_ACCESS_LOG"]
        }
      ],
      "knowledgeDomains": ["태양풍", "통신 장애", "보안 로그 전달"],
      "motiveDomains": ["정보 유출 노출", "통신 기록 감사", "외부 거래"],
      "relationshipSeeds": [
        {
          "characterId": "YUNA",
          "publicRelation": "화물 송수신 기록을 함께 관리했다.",
          "privatePossibilities": ["화물 기록 무마"]
        }
      ],
      "privateBackground": "경쟁 컨소시엄으로 정보를 빼돌린 정황이 있으나 사망 사건의 범인은 아니다.",
      "forbiddenCapabilities": ["MEDICAL_ADMIN", "LIFE_SUPPORT_WRITE", "UNLOGGED_OVERRIDE"]
    },
    {
      "id": "YUNA",
      "displayName": "유나 조",
      "occupation": "화물관리관",
      "suspect": true,
      "publicProfile": "화물창고와 도킹 물자 기록을 관리한다.",
      "persona": {
        "age": 29,
        "background": "소행성 채굴선의 하역 감독으로 시작해 정거장 화물관리관이 된 현장형 승무원이다.",
        "baselineAttitude": "활달하고 실무적인 말투로 창고의 물건과 사람 동선을 또렷하게 기억한다.",
        "pressureResponse": "사소한 실수는 먼저 인정하지만, 살인처럼 큰 혐의를 덮어씌우면 억울함보다 화물 현장의 구체적인 기록으로 반박한다.",
        "speechHabits": ["현장 물건과 순서를 구체적으로 말함", "솔직한 인정 후 바로 구분", "불공정한 고발에는 날카롭게 반문"]
      },
      "personalityTraits": ["현장 감각", "솔직함", "자존심", "불공정한 고발에만 날카로움"],
      "skills": ["CARGO_ACCOUNTING", "DOCKING_COORDINATION"],
      "physicalAccess": ["CARGO_BAY", "CENTRAL_HUB", "COMMON_AREA"],
      "systemPermissions": [
        {
          "systemId": "CARGO_SYSTEM",
          "allowedOperations": ["READ_MANIFEST", "UPDATE_STORAGE_SLOT"]
        },
        {
          "systemId": "DOCKING_SYSTEM",
          "allowedOperations": ["READ_DOCKING_SCHEDULE"]
        }
      ],
      "knowledgeDomains": ["화물 목록", "도킹 일정", "창고 동선"],
      "motiveDomains": ["밀반출 적발", "화물 감사", "징계 우려"],
      "relationshipSeeds": [
        {
          "characterId": "MAYA",
          "publicRelation": "자원 배분을 두고 자주 충돌했다.",
          "privatePossibilities": ["업무상 반감"]
        }
      ],
      "privateBackground": "희귀광물 밀반출을 숨기고 있으나 사망 사건의 범인은 아니다.",
      "forbiddenCapabilities": ["MEDICAL_ADMIN", "LIFE_SUPPORT_WRITE", "SECURITY_MASTER_OVERRIDE"]
    },
    {
      "id": "VICTIM",
      "displayName": "다니엘 로스",
      "occupation": "정거장 사령관",
      "suspect": false,
      "publicProfile": "정거장 내부 감사를 주도하던 사령관이다.",
      "persona": {
        "age": 51,
        "background": "오랜 우주 개발 현장의 사고 조사를 맡아 온 지휘관으로, 누구에게나 같은 기준을 적용하려 했다.",
        "baselineAttitude": "신중하고 공적인 말투를 쓴다.",
        "pressureResponse": "위기에도 책임을 회피하지 않는다.",
        "speechHabits": ["원칙을 먼저 말함", "사람보다 기록을 확인"]
      },
      "personalityTraits": ["원칙주의", "신중함", "책임감"],
      "skills": ["COMMAND_AUTHORIZATION", "BASIC_SYSTEMS"],
      "physicalAccess": ["COMMANDER_OFFICE", "CENTRAL_HUB", "COMMON_AREA"],
      "systemPermissions": [
        {
          "systemId": "COMMAND_SYSTEM",
          "allowedOperations": ["REVIEW_STATION_AUDIT", "APPROVE_RESOURCE_PLAN"]
        },
        {
          "systemId": "LIFE_SUPPORT",
          "allowedOperations": ["READ_STATUS"]
        }
      ],
      "knowledgeDomains": ["정거장 감사", "인사 기록", "자원 배분"],
      "motiveDomains": [],
      "relationshipSeeds": [
        {
          "characterId": "MAYA",
          "publicRelation": "부사령관과 긴밀히 협력했다.",